ListSchema={"schemaXmlList":["<Field ID=\"{fa564e0f-0c70-4ab9-b863-0177e6ddd247}\" Type=\"Text\" Name=\"Title\" DisplayName=\"危険回避策\" Required=\"TRUE\" SourceID=\"http://schemas.microsoft.com/sharepoint/v3\" StaticName=\"Title\" FromBaseType=\"TRUE\" MaxLength=\"255\" CustomFormatter=\"\" EnforceUniqueValues=\"FALSE\" Indexed=\"FALSE\" IMEMode=\"\" Hidden=\"FALSE\" ReadOnly=\"FALSE\" PITarget=\"\" PrimaryPITarget=\"\" PIAttribute=\"\" PrimaryPIAttribute=\"\" Aggregation=\"\" Node=\"\" />","<Field ID=\"{82642ec8-ef9b-478f-acf9-31f7d45fbc31}\" ReadOnly=\"TRUE\" Type=\"Computed\" Name=\"LinkTitle\" DisplayName=\"危険回避策\" DisplayNameSrcField=\"Title\" ClassInfo=\"Menu\" AuthoringInfo=\"(編集メニュー付きのアイテムにリンク)\" ListItemMenuAllowed=\"Required\" LinkToItemAllowed=\"Prohibited\" SourceID=\"http://schemas.microsoft.com/sharepoint/v3\" StaticName=\"LinkTitle\" FromBaseType=\"TRUE\"><FieldRefs><FieldRef Name=\"Title\" /><FieldRef Name=\"LinkTitleNoMenu\" /><FieldRef Name=\"_EditMenuTableStart2\" /><FieldRef Name=\"_EditMenuTableEnd\" /></FieldRefs><DisplayPattern><FieldSwitch><Expr><GetVar Name=\"FreeForm\" /></Expr><Case Value=\"TRUE\"><Field Name=\"LinkTitleNoMenu\" /></Case><Default><HTML><![CDATA[<div class=\"ms-vb itx\" onmouseover=\"OnItem(this)\" CTXName=\"ctx]]></HTML><Field Name=\"_EditMenuTableStart2\" /><HTML><![CDATA[\">]]></HTML><Field Name=\"LinkTitleNoMenu\" /><HTML><![CDATA[</div>]]></HTML><HTML><![CDATA[<div class=\"s4-ctx\" onmouseover=\"OnChildItem(this.parentNode); return false;\">]]></HTML><HTML><![CDATA[<span>&nbsp;</span>]]></HTML><HTML><![CDATA[<a onfocus=\"OnChildItem(this.parentNode.parentNode); return false;\" onclick=\"PopMenuFromChevron(event); return false;\" href=\"javascript:;\" title=\"メニューを開く\"></a>]]></HTML><HTML><![CDATA[<span>&nbsp;</span>]]></HTML><HTML><![CDATA[</div>]]></HTML></Default></FieldSwitch></DisplayPattern></Field>","<Field ID=\"{bc91a437-52e7-49e1-8c4e-4698904b2b6d}\" ReadOnly=\"TRUE\" Type=\"Computed\" Name=\"LinkTitleNoMenu\" DisplayName=\"危険回避策\" Dir=\"\" DisplayNameSrcField=\"Title\" AuthoringInfo=\"(アイテムへのリンク)\" EnableLookup=\"TRUE\" ListItemMenuAllowed=\"Prohibited\" LinkToItemAllowed=\"Prohibited\" SourceID=\"http://schemas.microsoft.com/sharepoint/v3\" StaticName=\"LinkTitleNoMenu\" FromBaseType=\"TRUE\"><FieldRefs><FieldRef Name=\"Title\" /><FieldRef Name=\"LinkFilenameNoMenu\" /></FieldRefs><DisplayPattern><IfEqual><Expr1><LookupColumn Name=\"FSObjType\" /></Expr1><Expr2>1</Expr2><Then><Field Name=\"LinkFilenameNoMenu\" /></Then><Else><HTML><![CDATA[<a onfocus=\"OnLink(this)\" href=\"]]></HTML><URL /><HTML><![CDATA[\" onclick=\"EditLink2(this,]]></HTML><Counter Type=\"View\" /><HTML><![CDATA[);return false;\" target=\"_self\">]]></HTML><Column HTMLEncode=\"TRUE\" Name=\"Title\" Default=\"(タイトルなし)\" /><IfEqual><Expr1><GetVar Name=\"ShowAccessibleIcon\" /></Expr1><Expr2>1</Expr2><Then><HTML><![CDATA[<img src=\"/_layouts/15/images/blank.gif?rev=47\" class=\"ms-hidden\" border=\"0\" width=\"1\" height=\"1\" alt=\"Shift キーを押しながら Enter キーを押してメニューを開きます (新しいウィンドウ)。\"/>]]></HTML></Then></IfEqual><HTML><![CDATA[</a>]]></HTML><IfNew><HTML><![CDATA[<img src=\"/_layouts/1041/images/new.gif\" alt=\"]]></HTML><HTML>新規</HTML><HTML><![CDATA[\" class=\"ms-newgif\" />]]></HTML></IfNew></Else></IfEqual></DisplayPattern></Field>","<Field ID=\"{5f190d91-3dbc-4489-9878-3c092caf35b6}\" Hidden=\"TRUE\" ReadOnly=\"TRUE\" Type=\"Computed\" Name=\"LinkTitle2\" DisplayName=\"危険回避策\" DisplayNameSrcField=\"Title\" ClassInfo=\"Menu\" AuthoringInfo=\"(編集メニュー付きのアイテムにリンク) (old)\" SourceID=\"http://schemas.microsoft.com/sharepoint/v3\" StaticName=\"LinkTitle2\" FromBaseType=\"TRUE\"><FieldRefs><FieldRef Name=\"Title\" /><FieldRef Name=\"LinkTitleNoMenu\" /><FieldRef Name=\"_EditMenuTableStart\" /><FieldRef Name=\"_EditMenuTableEnd\" /></FieldRefs><DisplayPattern><FieldSwitch><Expr><GetVar Name=\"FreeForm\" /></Expr><Case Value=\"TRUE\"><Field Name=\"LinkTitleNoMenu\" /></Case><Default><Field Name=\"_EditMenuTableStart\" /><SetVar Name=\"ShowAccessibleIcon\" Value=\"1\" /><Field Name=\"LinkTitleNoMenu\" /><SetVar Name=\"ShowAccessibleIcon\" Value=\"0\" /><Field Name=\"_EditMenuTableEnd\" /></Default></FieldSwitch></DisplayPattern></Field>"]}
"危険作業","危険回避策","更新者","更新日時","登録者","登録日時"
"材料荷降ろしの時につり荷が落下して人に当る","笛で合図してつり荷直下の人払いをする","norihito.sakaguchi@cloud-power.jp","2025-09-08T08:54:49Z","norihito.sakaguchi@cloud-power.jp","2025-09-08T08:54:49Z"
"高所作業、手作業による資材の取り扱い。","重い荷物や大きな荷物を、より小さく、軽く、扱いやすい単位に分割します。","hermits@cloud-power.jp","2025-10-08T08:45:35Z","hermits@cloud-power.jp","2025-10-08T08:45:35Z"
"水辺作業","ライフジャケットを着用する、救助用具を準備する、連絡手段を確保する","hermits@cloud-power.jp","2025-10-10T11:59:42Z","hermits@cloud-power.jp","2025-10-10T11:59:42Z"
"危険化学物質の取り扱い","耐薬品性個人用保護具（PPE）を着用する、換気された場所で作業する、MSDSガイドラインに従う","hermits@cloud-power.jp","2025-10-14T09:32:03Z","hermits@cloud-power.jp","2025-10-14T09:32:03Z"
"閉鎖空間への立ち入り閉鎖空間への立ち入り閉鎖空間への立ち入り閉鎖空間への立ち入り閉鎖空間への立ち入り閉鎖空間への立ち入り","空気質を検査する、呼吸器具を使用する、入退出許可制度に従う空気質を検査する、呼吸器具を使用する、入退出許可制度に従う","hermits@cloud-power.jp","2025-10-17T13:22:23Z","hermits@cloud-power.jp","2025-10-17T13:22:23Z"
